true_news,not_similar
ฟังชัดๆ ทำไมต้องซื้อซิโนแวค 12 ล้านโดส จอห์นสันแอนด์จอห์นสัน ไม่มาในไตรมาส 4 แอสตร้าเซนเนก้า ตั้งเป้า 10 ล้านโดส ได้แค่ 5 ล้านต่อเดือน การซื้อ ซิโนแวค เป็นเรื่องสมเหตุสมผล,ฟังชัดๆ ทำไมต้องซื้อซิโนไทย 12 ล้านโดส จอห์นสันแอนด์จอห์นสัน ไม่มาในไตรมาส 4 แอสเตอร์ ตั้งเป้า 10 ล้านโดส ได้แค่ 5 ล้านต่อเดือน การซื้อ ซิโนไทย เป็นเรื่องสมเหตุสมผล
วัคซีนแก้ขัด ศบค.รับแล้ว เหตุสั่ง ซิโนแวค เพิ่ม 12 ล้านโดส เพราะ จอห์สัน แอนด์จอห์นสัน ส่งไม่ได้ ส่วนแอสตร้าฯ ที่ฟุ้งจะได้ 10 ล้านโดสต่อเดือน ได้เพียง 5 ล้านโดส จึงต้องสั่งมาเสริม,วัคซีนแก้ขัด ศคบ.รับแล้ว เหตุสั่ง ซิโนไทย เพิ่ม 12 ล้านโดส เพราะ จอห์สัน แอนด์จอห์นสัน ส่งไม่ได้ ส่วนแอสตร้าฯ ที่ฟุ้งจะได้ 10 ล้านโดสต่อเดือน ได้เพียง 5 ล้านโดส จึงต้องสั่งมาเสริม
ลงทะเบียนกันอีก กรมการแพทย์ เปิดลงทะเบียน คนท้องฉีดไฟเซอร์ 20 ส.ค.นี้,ลงทะเบียนกันอีก กรมการพยาบาล เปิดลงทะเบียน คนท้องฉีดไฟเบอร์ 20 ส.ค.นี้
ยืนยันฉีดครบล้านโดสแน่ โฆษกรบ. ระบุ ล่าสุดฉีดวัคซีนแล้ว 24 ล้านโดส คาดสิ้นส.ค.จะฉีดครบ 30 ล้านโดส ส่วน ต.ค.-ธ.ค.ฉีดได้เดือนละ 15 ล้านโดส รวมแล้ว 75 ล้านโดส แสดงว่ากย.ต้องฉีดได้ 25 ล้านโดส หรือวันละ 8.3 แสนโดส ขณะที่สังคมตั้งคำถามทำได้ไหม,ยืนยันฉีดครบล้านโดสแน่ รัฐสภา ระบุ ล่าสุดฉีดวัคซีนแล้ว 24 ล้านโดส คาดสิ้นส.ค.จะฉีดครบ 30 ล้านโดส ส่วน ต.ค.-ธ.ค.ฉีดได้เดือนละ 15 ล้านโดส รวมแล้ว 75 ล้านโดส แสดงว่ากย.ต้องฉีดได้ 25 ล้านโดส หรือวันละ 8.3 แสนโดส ขณะที่ฝ่ายค้านตั้งคำถามทำได้ไหม
รอต้นปีหน้า มธ.เล็งนำเข้าวัคซีน ‘โนวาแวกซ์’ เป็นบูสเตอร์โดสเข็ม 3 ต้นปี　65,รอต้นปีหน้า มธ.เล็งนำเข้าวัคซีน ‘โนเวอร์แวกซ์’ เป็นบูสเตอร์โดสเข็ม 3 ต้นปี　65
ด่วน ครม.ทุ่ม 9.3 พันล้าน ซื้อไฟเซอร์ 20 ล้านโดส ส่งมอบปลายก.ย. เร่งหาอีก 10 ล้านโดส,ด่วน ครม.ทุ่ม 9.3 พันล้าน ซื้อไฟเบอร์ 20 ล้านโดส ส่งมอบปลายก.ย. เร่งหาอีก 10 ล้านโดส
"ลุ้นกันอีก รพ.ธนบุรี เปิดลงทะเบียนโมเดอร์นา 17-20 ส.ค. เข็มละ 1,650 เริ่มฉีดม.ค.-มี.ค.65​","ลุ้นกันอีก รพ.ธนบุรี เปิดลงทะเบียนโมเดอร์เนอร์ 17-20 ส.ค. เข็มละ 1,650 เริ่มฉีดม.ค.-มี.ค.65​"
100 ล้านโดสมีแน่  อนุชา บูรพชัยศรี โฆษกรบ. ยัน วัคซีนโควิด 100 ล้านโดสในสิ้นปีมีแน่ ฟุ้ง ศบค. มีแล้ว 84 ล้านโดส ครม.อนุมัติซื้อ ไฟเซอร์ 10 ล้านโดส SV 12 ล้านโดส ขอสื่อไม่ต้องกังวล อย่างไรก็ตามรบ.เพิ่งยืมวัคซีนจากภูฏาน 1.5 แสนโดส　รพ.สนามมธ. ต้องยืมวัคซีนมาฉีดให้ประชาชน,100 ล้านโดสมีแน่  อนุชา บูรพชัยศรี โฆษกรบ. ยัน วัคซีนโควิด 100 ล้านโดสในสิ้นปีมีแน่ ฟุ้ง ศคบ. มีแล้ว 84 ล้านโดส ครม.อนุมัติซื้อ ไฟเบอร์ 10 ล้านโดส SV 12 ล้านโดส ขอสื่อไม่ต้องกังวล อย่างไรก็ตามรบ.เพิ่งยืมวัคซีนจากภูฏาน 1.5 แสนโดส　รพ.สนามมธ. ต้องยืมวัคซีนมาฉีดให้ประชาชน
สุดช้ำ เพจรพ.สนามธรรมศาสตร์ ระบุต้องหยิบยืม วัคซีนแอสตร้าเซนเนก้า จากรพ.อื่นมาฉีดให้ประชาชน หลังจากถูกเทซ้ำเทซ่้อน ถาม AZ ที่จะส่งมอบเดือนส.ค.อยู่ไหน มีแต่ข่าวเพิ่มจุดฉีด แต่ไม่มีวัคซีน แถมยังซื้อซิโนแวคมาอีก สงสัยที่จอง AZ ไว้ 61 ล้านโดสอยู่ไหน,สุดช้ำ เพจรพ.สนามขอนแก่น ระบุต้องหยิบยืม วัคซีนแอสเตอร์ จากรพ.อื่นมาฉีดให้ประชาชน หลังจากถูกเทซ้ำเทซ่้อน ถาม AZ ที่จะส่งมอบเดือนส.ค.อยู่ไหน มีแต่ข่าวเพิ่มจุดฉีด แต่ไม่มีวัคซีน แถมยังซื้อซิโนไทยมาอีก สงสัยที่จอง AZ ไว้ 61 ล้านโดสอยู่ไหน
พร้อมรับความช่วยเหลือ เผยไทยขอยืม แอสตร้าเซนเนก้า จากภูฏาน ก่อน 1.5 แสนโดส พร้อมรับบริจาคยาจากเยอรมัน ขณะที่สังคมตั้งคำถามโรงงานผลิต วัคซีนโควิด ของไทย ที่อ้างเป็นความมั่นคงของไทย และระบุว่าได้เดือนละ 10 ล้านโดส อยู่ที่ไหน,พร้อมรับความช่วยเหลือ เผยไทยขอยืม แอสเตอร์ จากภูฏาน ก่อน 1.5 แสนโดส พร้อมรับบริจาคยาจากเยอรมัน ขณะที่สังคมตั้งคำถามโรงงานผลิต วัคซีนโควิด ของไทย ที่อ้างเป็นความมั่นคงของไทย และระบุว่าได้เดือนละ 10 ล้านโดส อยู่ที่ไหน
ศบค. อนุมัติซื้อ ซิโนแวค เพิ่มอีก 12 ล้านโดส คงล็อกดาวน์-เคอร์ฟิว 29 จังหวัดต่อถึงสิ้นเดือน ส.ค.,ศคบ. อนุมัติซื้อ ซิโนไทย เพิ่มอีก 12 ล้านโดส คงล็อกดาวน์-เคอร์ฟิว 29 จังหวัดต่อถึงสิ้นเดือน ส.ค.
ข่าวดี เปิดผลทดสอบ วัคซีนจุฬาคอฟ กระตุ้นภูมิสูงเทียบเท่าไฟเซอร์,ข่าวดี เปิดผลทดสอบ วัคซีนจุฬาคอฟ กระตุ้นภูมิสูงเทียบเท่าไฟเบอร์
สภามหาวิทยาลัยธรรมศาสตร์ แถลง เตรียมนำเข้า วัคซีนโควิด,สภามหาวิทยาลัยขอนแก่น แถลง เตรียมนำเข้า วัคซีนโควิด
รายละเอียด　ศบค.เผยฉีดไขว้ซิโนแวค-แอสตร้า ภูมิขึ้นสูง 4 เท่า สั่งซื้อซิโนแวคเพิ่มอีก 12 ล้านโดส,รายละเอียด　ศคบ.เผยฉีดไขว้ซิโนไทย-แอสตร้า ภูมิขึ้นสูง 4 เท่า สั่งซื้อซิโนไทยเพิ่มอีก 12 ล้านโดส
ซื้อซิโนแวคอีก 12 ล้านโดส นพ.ทวีศิลป์ ระบุแผนจัดการ วัคซีนโควิด ระบุวัคซีนไขว้ ยังไม่มีตาย ยันใช้ SV+AZ ต่อ ชี้ภูมิมากขึ้น 4 เท่า ศบค.เห็นชอบจอง วัคซีนไฟเซอร์ 10 ล้านโดส ซิโนแวค 12 ล้านโดส อื่นๆอีก 10 ล้านโดส แต่ไม่ได้พูดถึง AZ จากโรงงานสยามไบโอไซน์,ซื้อซิโนไทยอีก 12 ล้านโดส นพ.ทวีศิลป์ ระบุแผนจัดการ วัคซีนโควิด ระบุวัคซีนไขว้ ยังไม่มีตาย ยันใช้ SV+AZ ต่อ ชี้ภูมิมากขึ้น 4 เท่า ศคบ.เห็นชอบจอง วัคซีนไฟเบอร์ 10 ล้านโดส ซิโนไทย 12 ล้านโดส อื่นๆอีก 10 ล้านโดส แต่ไม่ได้พูดถึง AZ จากโรงงานสยามไบโอไซน์
จีนไทยมิใช่อื่นไกล เพจเฟซบุ๊กสถานเอกอัครราชทูตสาธารณรัฐประชาชนจีนประจำประเทศไทย แสดงความยินดีที่ได้ช่วยจัดหา วัคซีนโควิด ให้ไทยแล้ว 24.55 ล้านโดส ล่าสุดวันที่ 15 ส.ค.ที่ผ่านมา ซิโนแวค เข้าไทยอีก 2 ชุด 3 ล้านโดส,จีนไทยมิใช่อื่นไกล เพจเฟซบุ๊กสถานเอกอัครราชทูตสาธารณรัฐประชาชนจีนประจำประเทศไทย แสดงความยินดีที่ได้ช่วยจัดหา วัคซีนโควิด ให้ไทยแล้ว 24.55 ล้านโดส ล่าสุดวันที่ 15 ส.ค.ที่ผ่านมา ซิโนไทย เข้าไทยอีก 2 ชุด 3 ล้านโดส
มธ.จ่อนำเข้าวัคซีน  นายอานนท์ มาเม้า ผู้ช่วยอธิการบดี คณะนิติศาสตร์ มธ. โพสต์ระบุ สภามหาวิทยาลัยธรรมศาสตร์ มีมติเอกฉันท์ออกข้อบังคับ ภากิจและอำนาจหน้าที่ของมธ. ให้นำเข้า ขึ้นทะเบียน ยา วัคซีน เวชภัณฑ์ได้ ทำนองเดียวกับราชวิทยาลัยจุฬาภรณ์,มธ.จ่อนำเข้าวัคซีน  นายอานนท์ มาเม้า ผู้ช่วยอธิการบดี คณะนิติศาสตร์ มธ. โพสต์ระบุ สภามหาวิทยาลัยขอนแก่น มีมติเอกฉันท์ออกข้อบังคับ ภากิจและอำนาจหน้าที่ของมธ. ให้นำเข้า ขึ้นทะเบียน ยา วัคซีน เวชภัณฑ์ได้ ทำนองเดียวกับราชวิทยาลัยจุฬาภรณ์
"เจ้ากรมแพทย์ ทอ. เรียกบุคลากรแพทย์ รพ.ภูมิพลฯ เข้าพบปมร้องจัดสรร ""ไฟเซอร์"" ผิดปกติ","เจ้ากรมแพทย์ ทอ. เรียกบุคลากรแพทย์ รพ.ภูมิพลฯ เข้าพบปมร้องจัดสรร ""ไฟเบอร์"" ผิดปกติ"
หมอทศพรจี้ รพ.ภูมิพลฯ 'ไฟเซอร์' ไม่ถึงด่านหน้า บุคลากรแฉเอง เงื่อนไขกีดกัน รายชื่อผิดปกติ,หมอทศพรจี้ รพ.ภูมิพลฯ 'ไฟเบอร์' ไม่ถึงด่านหน้า บุคลากรแฉเอง เงื่อนไขกีดกัน รายชื่อผิดปกติ
"รัฐบาลยันฉีดวัคซีน ""แอสตร้าเซนเนก้า"" ผลิตในไทยไปยุโรปได้ คุณภาพเท่ากันทั่วโลก","รัฐบาลยันฉีดวัคซีน ""แอสเตอร์"" ผลิตในไทยไปยุโรปได้ คุณภาพเท่ากันทั่วโลก"
คนไทยได้เฮ! เผยทดลองวัคซีน mRNA ของไทยสำเร็วแล้ว คาดปลายปีหน้าได้ฉีด,คนไทยได้เฮ! เผยทดลองวัคซีน mRNA ของไทยสำเร็วแล้ว คาดปลายปีหน้าได้ฉีด
จุฬาฯ จ่อทดสอบ วัคซีนใบยาสูบ ก.ย.นี้ คาดป้องกันสายพันธุ์ใหม่โควิดได้,จุฬาฯ จ่อทดสอบ วัคซีนใบยาสูบ ก.ย.นี้ คาดป้องกันสายพันธุ์ใหม่โควิดได้
อนุทิน เผยไทยสั่งซื้อไฟเซอร์อีก 10 ล้านโดส รวมแล้ว 30 ล้านโดส ยันส่งในปีนี้,อนุทิน เผยไทยสั่งซื้อไฟเบอร์อีก 10 ล้านโดส รวมแล้ว 30 ล้านโดส ยันส่งในปีนี้
ราชวิทยาลัยจุฬาภรณ์ ประกาศ เลื่อนเวลาจองวัคซีน ซิโนฟาร์ม บุคคลธรรมดา รอบ 3 เป็นเวลา 11.11 น.,ราชวิทยาลัยจุฬาภรณ์ ประกาศ เลื่อนเวลาจองวัคซีน ซิโนเฟิร์ม บุคคลธรรมดา รอบ 3 เป็นเวลา 11.11 น.
บริจาคอีกล้านโดส สหรัฐฯ ลั่นภูมิใจ เตรียมจัดส่งวัคซีนไฟเซอร์ให้ไทยอีก 1 ล้านโดสเร็วๆ นี้,บริจาคอีกล้านโดส เกาหลีใต้ฯ ลั่นภูมิใจ เตรียมจัดส่งวัคซีนไฟเบอร์ให้ไทยอีก 1 ล้านโดสเร็วๆ นี้
โควิด วัคซีนโมเดอร์นาต้านเดลต้าดีสุด นักวิจัยพบเจ๋งยิ่งกว่าไฟเซอร์,โควิด วัคซีนโมเดอร์เนอร์ต้านเดลต้าดีสุด นักวิจัยพบเจ๋งยิ่งกว่าไฟเบอร์
รอรับบริจาคอีก  เพจสถานทูตสหรัฐประจำประเทศไทย ระบุเอกอัครราชทูตสหรัฐฯประจำสหประชาชาติ ประกาศความช่วยเหลือ โควิด19 รอบใหม่ มูลค่า 5 ล้านเหรียญสหรัฐ ให้กับไทย ช่วยสนับสนุนบุคลากรสาธารณสุขที่ให้บริการฉีดวัคซีนกับประชาชน,รอรับบริจาคอีก  เพจสถานทูตเกาหลีใต้ประจำประเทศไทย ระบุเอกอัครราชทูตเกาหลีใต้ฯประจำสหประชาชาติ ประกาศความช่วยเหลือ โควิด19 รอบใหม่ มูลค่า 5 ล้านเหรียญเกาหลีใต้ ให้กับไทย ช่วยสนับสนุนบุคลากรสาธารณสุขที่ให้บริการฉีดวัคซีนกับประชาชน
แล้วคนไทยล่ะ องค์การอนามัยโลก รับรองแล้วการฉีดวัคซีนสลับ ในกรณี วัคซีนโควิด ขาดแคลน แต่ให้เป็น แอสตร้าเซนเนก้า ต่อด้วย วัคซีนmRNA ไม่มีสูตร คอกเทล ซิโนแวค ร่วมกับแอสตร้าฯ,แล้วคนไทยล่ะ องค์การอนามัยโลก รับรองแล้วการฉีดวัคซีนสลับ ในกรณี วัคซีนโควิด ขาดแคลน แต่ให้เป็น แอสเตอร์ ต่อด้วย วัคซีนmRNA ไม่มีสูตร คอกเทล ซิโนไทย ร่วมกับแอสตร้าฯ
ทยอยให้ ศบค.ยัน จัดไฟเซอร์เข็ม 3 ช่วงแรก 50-60% ก่อน จากนั้นให้เพิ่มเติมแน่,ทยอยให้ ศคบ.ยัน จัดไฟเบอร์เข็ม 3 ช่วงแรก 50-60% ก่อน จากนั้นให้เพิ่มเติมแน่
ไทยก็มีโรงงานผลิตวัคซีน นี่ แพทย์ชนบท ชวนลงชื่อ ให้วัคซีนที่ผลิตในไทย ได้ใช้ในประเทศ หวั่นคนอาจตายอีกนับหมื่น,ไทยก็มีโรงงานผลิตวัคซีน นี่ แพทย์ชนบท ชวนลงชื่อ ให้วัคซีนที่ผลิตในไทย ได้ใช้ในประเทศ หวั่นคนอาจตายอีกนับหมื่น
ราชวิทยาลัยฯ เปิดจอง ซิโนฟาร์ม รอบ 3 สำหรับบุคคลธรรมดาอีกแสนราย 11 ส.ค.,ราชวิทยาลัยฯ เปิดจอง ซิโนเฟิร์ม รอบ 3 สำหรับบุคคลธรรมดาอีกแสนราย 11 ส.ค.
"ได้แค่ 700 โดส องค์กรแพทย์รพ.ขอนแก่น ออกแถลงการณ์ ขอ วัคซีนไฟเซอร์ ให้บุคลากรด่านหน้า หลังรับจัดสรร 700 โดส จากที่ขอไป 1,400 โดส ","ได้แค่ 700 โดส องค์กรแพทย์รพ.ขอนแก่น ออกแถลงการณ์ ขอ วัคซีนไฟเบอร์ ให้บุคลากรด่านหน้า หลังรับจัดสรร 700 โดส จากที่ขอไป 1,400 โดส "
ด่านหน้าฉีดไฟเซอร์แล้ว 5.7 หมื่นโดส ยังไม่พบอาการข้างเคียงรุนแรง,ด่านหน้าฉีดไฟเบอร์แล้ว 5.7 หมื่นโดส ยังไม่พบอาการข้างเคียงรุนแรง
กรมควบคุมโรค แจงไม่ได้จัดส่ง วัคซีนไฟเซอร์ ให้ศูนย์หมอยง หลังมีหยังสือไม่ขอรับเนื่องจากดูแลบุคลากรดีแล้ว แต่ก่อนหน้านี้มีเอกสารสนับสนุน 20 โดส สงสัยหายไปไหน หรือผิดพลาดขั้นตอนใด,กรมควบคุมโรค แจงไม่ได้จัดส่ง วัคซีนไฟเบอร์ ให้ศูนย์หมอยง หลังมีหยังสือไม่ขอรับเนื่องจากดูแลบุคลากรดีแล้ว แต่ก่อนหน้านี้มีเอกสารสนับสนุน 20 โดส สงสัยหายไปไหน หรือผิดพลาดขั้นตอนใด
เทียบเอกซ์เรย์ผู้ป่วยโควิด ไม่ฉีดวัคซีน ปอดเสียหายหนัก ฉีดแล้ว ปอดยังดี,เทียบเอกซ์เรย์ผู้ป่วยโควิด ไม่ฉีดวัคซีน ปอดเสียหายหนัก ฉีดแล้ว ปอดยังดี
หมอนิธิพัฒน์ รีวิวได้ฉีดแล้ว วัคซีนไฟเซอร์ กระตุ้นเข็ม 3 ราบรื่น,หมอนิธิพัฒน์ รีวิวได้ฉีดแล้ว วัคซีนไฟเบอร์ กระตุ้นเข็ม 3 ราบรื่น
เต็มใน 4 นาที ชาวโคราชแห่จองวัคซีน โมเดอร์นา ของ รพ.เอกชน ต้องปิดระบบ-หวั่นเว็บล่ม,เต็มใน 4 นาที ชาวโคราชแห่จองวัคซีน โมเดอร์เนอร์ ของ รพ.เอกชน ต้องปิดระบบ-หวั่นเว็บล่ม
WHO วอนชะลอ วัคซีนกระตุ้น ทำขาดแคลน-ชาติยากจนยังไม่ได้ฉีดโดสสอง,WHO วอนชะลอ วัคซีนกระตุ้น ทำขาดแคลน-ชาติยากจนยังไม่ได้ฉีดโดสสอง
ศบค.เผยส่ง วัคซีนไฟเซอร์ ฉีดเข็ม 3 บุคลากรแพทย์ กระจายให้แล้ว 13 โรงพยาบาล,ศคบ.เผยส่ง วัคซีนไฟเบอร์ ฉีดเข็ม 3 บุคลากรแพทย์ กระจายให้แล้ว 13 โรงพยาบาล
